{
  "category": "npc",
  "name": "Sir Tinkelstein of Gnomewood",
  "description": "\"I am Sir Tinkelstein, Knight of the Emerald Cog, Defender of the Small, Champion ofâ€”\" He listed all twelve titles before you could interrupt. Wears elaborate but well-worn armor covered in medals and decorations.",
  "footer": "Example Campaign",
  "portrait": "v4-portrait.png",
  "image_prompt": "Gnome knight mid-proclamation, one hand raised dramatically, wearing elaborate but worn armor with many decorations and medals, tavern background, fantasy art, expressive face"
}
