{
  "category": "npc",
  "name": "Grimble Thornwick",
  "description": "A tinkering gnome inventor with perpetually soot-stained fingers and an infectious enthusiasm for clockwork contraptions. His workshop is legendary for both its ingenious devices and occasional explosions.",
  "footer": "Thornwick's Emporium",
  "portrait": "portrait.png"
}
